id,name,description,head_of_department,parent_department,members
dep_641641f1,Human Resources,"Hiring, onboarding, policies",emp_12b59527,,emp_12b59527 emp_f9802ae5 emp_e0ba6ddb emp_8cae19d5 emp_eab5752d
dep_38ddd673,Engineering,Product development and systems,emp_133d2974,,emp_43392277 emp_993c7ea2 emp_a6a7764c emp_e3c1cc1b emp_87164232 emp_afd10b18 emp_133d2974 emp_5f555006
dep_5389d09d,Finance,"Budgeting, payroll, reporting",emp_51358a87,,emp_0efb4040 emp_ee5e39e8 emp_d5284351 emp_51358a87 emp_e34c2364
dep_2ec7d2b0,Support,Customer support operations,emp_3e6603e4,,emp_f22363fc emp_3e6603e4
dep_82786cf5,IT Operations,"Infrastructure, support, security, networks",emp_7805c9bb,,emp_7805c9bb emp_b17a9e4a emp_0688c3b7 emp_553623c8 emp_4ebe9765
